{
  "schemaVersion": 1,
  "id": "97d24ec6-e6ee-41a8-9ad7-e0198f50c2b6",
  "name": "每日信息整理",
  "description": "接收手动输入，经 Agent 整理后输出结果。",
  "revision": 0,
  "nodes": [
    {
      "id": "trigger",
      "type": "manualTrigger",
      "typeVersion": 1,
      "name": "手动触发",
      "position": { "x": 80, "y": 180 },
      "disabled": false,
      "config": {},
      "inputs": {}
    },
    {
      "id": "agent",
      "type": "agent",
      "typeVersion": 1,
      "name": "整理信息",
      "position": { "x": 380, "y": 180 },
      "disabled": false,
      "config": { "prompt": "请将输入整理成清晰的行动摘要。" },
      "inputs": {
        "input": { "kind": "nodeOutput", "nodeId": "trigger", "path": "/" }
      }
    },
    {
      "id": "output",
      "type": "output",
      "typeVersion": 1,
      "name": "输出",
      "position": { "x": 680, "y": 180 },
      "disabled": false,
      "config": {},
      "inputs": {
        "input": { "kind": "nodeOutput", "nodeId": "agent", "path": "/text" }
      }
    }
  ],
  "edges": [
    {
      "id": "trigger-agent",
      "sourceNodeId": "trigger",
      "sourcePort": "output",
      "targetNodeId": "agent",
      "targetPort": "input"
    },
    {
      "id": "agent-output",
      "sourceNodeId": "agent",
      "sourcePort": "output",
      "targetNodeId": "output",
      "targetPort": "input"
    }
  ],
  "settings": {
    "timezone": "Asia/Shanghai",
    "maxDurationMs": 300000,
    "maxConcurrency": 4,
    "onMissedSchedule": "skip"
  },
  "createdAt": 1784563200000,
  "updatedAt": 1784563200000
}
